{"Geometry" : {
  "case" : "1D"},
 "IonomerMembrane" : {
   "length" : 2.5e-6,
   "N" : 5,
   "widthFractions" : {
     "oxygenCatalystSide" : 0.2,
     "hydrogenCatalystSide" : 0.1}},
 "OxygenEvolutionElectrode" : {
   "PorousTransportLayer" : {
     "length" : 5.1e-6,
     "N" : 6,
     "widthFractions" : {
       "main" : 0.33,
       "ionomerside" : 0.14}},
   "CatalystLayer" : {
     "length" : 1e-6,
     "N" : 3}},
 "HydrogenEvolutionElectrode" : {
   "PorousTransportLayer" : {
     "length" : 5.1e-6,
     "N" : 7,
     "widthFractions" : {
       "main" : 0.33,
       "ionomerside" : 0.12}},
   "CatalystLayer" : {
     "length" : 1e-6,
     "N" : 6}}
}
